{
    "$schema": "https://json-schema.org/draft/2020-12/schema",
    "$id": "/schemas/data/open_science/events.schema.json",
    "title": "Open Science events schema",
    "description": "Schema for validating events objects used in the open science section of data.scilifelab.se",
    "type": "array",
    "items": {
      "type": "object",
      "required": [
        "title",
        "type",
        "date_start",
        "venue",
        "event_url",
        "description"
      ],
      "properties": {
        "title": {
          "type": "string",
          "minLength": 1,
          "description": "Title of the event."
        },
        "type": {
          "type": "string",
          "minLength": 1,
          "description": "Type of the event (examples: Event, Conference, etc)."
        },
        "date_start": {
          "type": "string",
          "description": "Start date of the event in YYYY-MM-DD format.",
          "pattern": "^[0-9]{4}-[0-9]{2}-[0-9]{2}$"
        },
        "time_start": {
          "type": "string",
          "description": "OPTIONAL: Start time of the event in HH:MM format.",
          "pattern": "^([0-9]{2}:[0-9]{2})?$"
        },
        "date_end": {
          "type": "string",
          "description": "OPTIONAL: End date of the event in YYYY-MM-DD format.",
          "pattern": "^([0-9]{4}-[0-9]{2}-[0-9]{2})?$"
        },
        "time_end": {
          "type": "string",
          "description": "OPTIONAL: End time of the event in HH:MM format.",
          "pattern": "^([0-9]{2}:[0-9]{2})?$"
        },
        "venue": {
          "type": "string",
          "minLength": 1,
          "description": "Event venue."
        },
        "organisers": {
          "type": "string",
          "description": "OPTIONAL: Name of institute or team who organise the event."
        },
        "event_url": {
          "type": "string",
          "description": "URL linking to the event.",
          "pattern": "^(https?:\\/\\/|\\/).+"
        },
        "description": {
          "type": "string",
          "minLength": 1,
          "description": "Short description about the event."
        }
      },
      "additionalProperties": false
    }
}
